{
  "contract": "quiltor.sqlite-migrations",
  "version": 1,
  "baselineSchemaVersion": 1,
  "currentSchemaVersion": 14,
  "direction": "forward-only",
  "steps": [
    {
      "from": 1,
      "to": 2,
      "guarantees": ["Adds last_restore_at metadata without changing document revisions."]
    },
    {
      "from": 2,
      "to": 3,
      "guarantees": ["Adds owner_sub metadata with the local owner as its stable default."]
    },
    {
      "from": 3,
      "to": 4,
      "guarantees": ["Adds temporal relationship state and optional death-moment references."]
    },
    {
      "from": 4,
      "to": 5,
      "guarantees": ["Adds a primary time system without changing the figures revision."]
    },
    {
      "from": 5,
      "to": 6,
      "guarantees": ["Adds indexed entity-alias persistence without changing the figures revision."]
    },
    {
      "from": 6,
      "to": 7,
      "guarantees": [
        "Migrates the legacy empty owner_sub sentinel to quiltor-internal:local-owner without changing document revisions."
      ]
    },
    {
      "from": 7,
      "to": 8,
      "guarantees": [
        "Adds normalized optional chapter story-time moment and range references without changing chapter order or document revisions."
      ]
    },
    {
      "from": 8,
      "to": 9,
      "guarantees": [
        "Adds a recursive manuscript binder and migrates every existing chapter to the root without changing chapter identity, order, prose, or document revisions."
      ]
    },
    {
      "from": 9,
      "to": 10,
      "guarantees": [
        "Adds stable figure-profile field identities and migrates every non-empty legacy fixed or custom profile value without changing figure identity, notes, references, or document revisions."
      ]
    },
    {
      "from": 10,
      "to": 11,
      "guarantees": [
        "Adds an independently revisioned non-canon Storyboard document and one stable default Main Storyboard without changing manuscript, story-world, or existing world data."
      ]
    },
    {
      "from": 11,
      "to": 12,
      "guarantees": [
        "Adds content-addressed storage for place map images inside the world database, so that backup, history, and restore carry them without a manifest change, and without touching document revisions or existing world data."
      ]
    },
    {
      "from": 12,
      "to": 13,
      "guarantees": [
        "Renames the two manuscript settings that still carried German keys: the hidden insert-panel elements move from `elementeVerborgen` to `hiddenElements` inside the settings' passthrough bag, and any stale `zeichenAktiv` left in that bag is dropped because the active symbols live in their own column. Runs when a world is opened, leaves document revisions untouched, and is a no-op for a world that never stored either key."
      ]
    },
    {
      "from": 13,
      "to": 14,
      "guarantees": [
        "Renames the last two German keys inside stored assistant responses, where a proposal that is still applicable kept the spelling it was written in: `notizen` becomes `notes` and `gerichtet` becomes `directed`, an already present English key wins, and only object keys are touched so the German prose these answers cite stays as it is. Runs when a world is opened, leaves document revisions and every other table untouched, and is a no-op for a world whose history never carried either key."
      ]
    }
  ]
}
